{
	"name": "agents",
	"displayName": "Agents",
	"description": "Reusable sub-agent definitions: code-reviewer, security-reviewer, test-engineer, architecture-auditor, build-error-resolver, performance-optimizer, database-reviewer.",
	"author": {
		"name": "Heretek-AI",
		"url": "https://github.com/Heretek-AI"
	},
	"license": "MIT",
	"dependencies": []
}
